{
  "schemaVersion": 3,
  "document": {
    "path": "eval/cases/grounding-basic/document.md",
    "contentHash": "sha256:7d377a4a02b9dab440dd505e3aa603bad211c5defe502be609a42e5f83491594"
  },
  "contract": {
    "path": "eval/cases/grounding-basic/document.md.intent.yml",
    "contractHash": "sha256:d92f77220ce045796ece41253bb2f435b8ecc5c9471017ea0d5da3c364dbc277"
  },
  "rubricHash": "sha256:b8d91f403620d480744c2b932a0c34855f1032cf137a0935ed2ebb6637d84478",
  "evidenceHash": "sha256:3fa778856c87ebd5f296c8d7029de378ac14e0ecb507896c9f8c76e5ef6e124e",
  "judge": {
    "provider": "human",
    "model": "gold-label",
    "promptVersion": "3"
  },
  "evaluations": [
    {
      "checkId": "p95-latency-fact",
      "verdict": "meets",
      "resolution": "none",
      "justification": "本文3行目にp95応答時間が明記され、benchmarkの3行目と一致する",
      "location": {
        "startLine": 3,
        "endLine": 3
      },
      "claimIds": [
        "claim-001"
      ],
      "repairableByAgent": false
    }
  ],
  "authorEvaluations": [],
  "groundingCoverage": {
    "status": "reviewed",
    "justification": "性能に関する検証可能な主張を確認した"
  },
  "claimEvaluations": [
    {
      "claimId": "claim-001",
      "text": "測定環境では、p95の応答時間は100msでした。",
      "kind": "factual",
      "verdict": "supported",
      "resolution": "none",
      "justification": "benchmarkの3行目にp95応答時間100msと記録されている",
      "location": {
        "startLine": 3,
        "endLine": 3
      },
      "evidence": [
        {
          "sourceId": "benchmark",
          "startLine": 3,
          "endLine": 3
        }
      ],
      "repairableByAgent": false
    }
  ],
  "excessCoverage": {
    "status": "none_found",
    "justification": "本文は一文だけで、既出の言い直しや契約外の記述がない"
  },
  "excessEvaluations": []
}
